Year,Title,Link,Abstract
2024,Aquaculture Basket Detection and Tracking for Autonomous Surface Vehicles,https://hdl.handle.net/1721.1/156768,"With the global population on the rise, there is an increased demand for seafood, underscoring the crucial role of aquaculture- the practice of farming aquatic organisms [1]. In the realm of aquaculture, oyster farming is relatively low maintenance, except for the challenge of manually flipping heavy oyster-laden bags. To address this issue, MIT Sea Grant introduced the Oystermaran, an autonomous catamaran specifically designed for this task. This thesis presents contributions to the electronics, controls, and perception systems of the Oystermaran project. In particular, it presents an oyster basket detection and tracking method using the object detector You Only Look Once (YOLO) [2]. In addition, the electronics system has been updated and new manual controllers were created to enable the use of a new f lipping mechanism developed this year. This system is evaluated on data from field testing at Ward Aquafarms, a Cape Cod-based oyster farming business. The results show that oyster baskets can be robustly detected in new environments, despite environmental factors. This marks a significant step towards real-time viability for autonomous oyster farming."
2024,Maintenance and Metalearning of Time Interval Representations,https://hdl.handle.net/1721.1/153772,"When we perform actions in the world, we estimate what is happening around us. That information goes through a series of transformations in the brain in order to execute an action that meets our goals. For example, we might remember the speed of a car in order to decide when to cross the road. These transformations can be simple, for example based on physics models of speed and time, like the car example, or they can be complex and built around evolutionary and experience-based statistical regularities in the world. This thesis uses a sensorimotor time production task to investigate different types of transformation and noise that exist between observation and action. First, I will propose a task which utilizes memory of a time interval in order to probe memory noise, memory storage, and inference over internal noise. To do this, monkeys perform a delayed time reproduction task. I find that the behavior is consistent with the the brain storing the memory as a function of time, and that the inference does not mitigate the internal memory noise. Second, I investigate how estimated prior distributions change when the statistical regularities of the world change. Monkeys perform a blocked time reproduction task, and behavior across policy transitions shows fast adaptation to new policies. I apply this algorithm to a model and fit it to behavioral data.  Third, I display some preliminary neural data gathered during these tasks as well as hypotheses for neural implementation. With these experiments, I utilize a simple task to pick apart transformations that occur between observation and action."
2023,Systemic risk in the interbank lending market,http://hdl.handle.net/1721.1/117814,"Our goal is to understand the functioning of the interbank lending market in times of market stress. Working towards this goal, we conduct theoretical analysis and simulation to study the effects of network structure and shock scenarios on systemic risk in the market. We consider shocks of various sizes at both global and local scales. In terms of risk measures, we study relative systemic loss and the default rate, separating the latter quantity into fundamental default and contagion. Our simulations suggest that all systemic risk measures are similar on the well-studied directed Erdős-Rényi model and the more complex fitness model if we match the mean density and the mean edge weight of these two models. We show through both derivations and simulations that the network size has little effect on systemic risk when the network is sufficiently large. Moreover, as the mean degree grows, the different default rates considered all increase, while relative systemic loss decreases. Furthermore, simulations suggest that local shocks tend to cause more harm than global shocks of the same total size. We also derive upper and lower bounds on a bank's probability of default, only using its neighbors' information. For implementation, we build a method for real-time, automatic, interpretable assessment of financial systemic risk, which only requires temporal snapshots of observable data. Our algorithm takes in partial data, inferring a random graph model, and then generates empirical distributions for risk measures. The first part relies on inferring a fitness model that is compatible with observed information. For the second part, we use simulations to obtain empirical distributions for systemic risk that arises from interbank clearing. We test our method on synthetic data and apply it to the federal funds market using empirical data. Our method is fast enough to be incorporated into algorithms that produce intraday time trajectories of risk prediction. The data requirement is practical for investors as well as regulators, policy-makers, and financial institutions."
2023,Accelerated algorithms for constrained optimization and control,https://hdl.handle.net/1721.1/152459,"Nonlinear optimization with equality and inequality constraints is a ubiquitous problem in several optimization and control problems in large-scale systems. Ensuring feasibility along with reasonable convergence to optimal solution remains an open and pressing problem in this area. 

A class of high-order tuners was recently proposed in adaptive control literature with an effort to lead to accelerated convergence for the case when no constraints are present. In this thesis, we propose a new high-order tuner based algorithm that can
accommodate the presence of equality and inequality constraints. We leverage the linear dependence in solution space to guarantee that equality constraints are always satisfied. We further ensure feasibility with respect to inequality constraints for the specific case of box constraints by introducing time-varying gains in the high-order tuner while retaining the attractive accelerated convergence properties. Theoretical guarantees pertaining to stability are also provided for time-varying regressors. These theoretical propositions are validated by applying them to several categories of optimization problems, in the form of academic examples, power flow optimization and neural network optimization.

We devote special attention to analyze a special case of neural network optimization, namely, linear neural network training problem, to understand the dynamics of nonconvex optimization governed by gradient flow and provide lyapunov stability guarantees for LNNs."
2023,"First-principles control of zeolite synthesis, transformations, and intergrowth",https://hdl.handle.net/1721.1/153084,"Designing new materials enabling of sustainable catalysis and separations is essential to fully decarbonize the industrial sector, but materials discovery is hindered by labor-intensive experimentation. Computational methods such as high-throughput screening or machine learning can filter structures and compositions prior to experiments. Nevertheless, finding synthesis routes to realize computationally proposed materials still relies on trial-and-error. This thesis describes how materials discovery can be streamlined using high-throughput simulations, physics-based representations, and machine learning. In particular, this work analyzes the synthesis, phase transformations, and intergrowth of zeolites, which are industrially relevant catalysts and molecular sieves known for their hard-to-control phase competition and polymorphism.

Part I of this thesis describes the development of methods to simulate and analyze zeolite transformations and template-based synthesis. Diffusionless phase transformations and intergrowths are predicted by using graph-based representations of zeolite frameworks. Moreover, a data-driven analysis indicates how  structural factors are often insufficient to predict outcomes in their synthesis. To address this knowledge gap, computational tools are developed to simulate template-based synthesis conditions for zeolites. The proposed methods accelerate the prediction of binding energies between molecular templates and zeolite hosts, reducing computational costs by up to two orders of magnitude while increasing the reproducibility of the calculations. These tools are then used to simulate hundreds of thousands of template-zeolite pairs in a high-throughput screening pipeline. The simulation results explain thousands of synthesis outcomes from the zeolite literature from the past six decades and recall archetypical templates purely from physical principles.

Part II of this thesis leverages these methods to design new zeolite synthesis routes, thus enabling the control of phase competition, intergrowth, and catalytic properties of the materials. The computational tools guide the experimental synthesis of zeolites with improved catalytic behavior, including pure-phase frameworks with low-cost templates and disordered structures with tunable polymorph selectivity. Finally, the computational approach maps numerous possibilities for further discovery based on over 35 million data points generated using machine learning, which is used to decode this “zeolite genome”. This work provides a roadmap on how synthesis routes for zeolites can be controlled a priori using theory and computation."
2023,"DNA sequence design of non-orthogonal binding networks, and application to DNA data storage",https://hdl.handle.net/1721.1/153069,"DNA has proven itself a powerful tool in a diverse array of nanotechnology-related domains, including molecular computation, nanostructure fabrication, and data storage. Most DNA-based systems focus on using sets of DNA sequences that are orthogonal to each other, such that each DNA sequence has a dedicated binding partner, its complementary sequence. This design approach reduces the number of interactions that must be considered when predicting how a system will behave, at the cost of reducing the information-gathering ability of each molecular unit.

Relatively little research has attempted to solve the problem of designing promiscuous, or non-orthogonal, DNA sequences, which are characterized by their ability to bind to several distinct partners with variable binding affinities. Yet there are many situations in which this type of dense interaction network can be useful. For example, in neural networks, a node will often take inputs from hundreds or thousands of upstream nodes, allowing it to condense large amounts of information into a single output value. While naturally occurring biological networks often make use of promiscuous binding behavior, the field of molecular computing currently lacks a general-purpose and efficient method for non-orthogonal DNA sequence design.

In this thesis, I describe a novel, robust, and broadly applicable method for designing small or large sets of non-orthogonal DNA sequences. This method takes an arbitrary matrix of pairwise binding affinities, and attempts to design DNA sequences such that the differential binding affinity between any two pairs of sequences is proportional to the difference in the corresponding elements of the matrix. The key innovation of this method is the reformulation of the matrix via a binary embedding, which reduces the design specification to a set of binary strings that permit relatively straightforward sequence design.

Not all matrices permit a binary embedding and I consider three cases here: when a binary embedding exists, when it is unknown if it exists, and when it does not exist. When it exists, I show through both simulation and experiment that DNA sequences can be designed with high precision. When it is unknown if a binary embedding exists, I give novel conditions for determining existence via representation of the matrix in a weighted graph. Finally, when an exact binary embedding does not exist, I develop an alternative method using approximate binary embeddings. To demonstrate the power of this method, I apply to the task of similarity searching in a large, simulated DNA databases, where I show that it outperforms the existing state of the art. I hope that this work opens the door to further innovations in designing and applying non-orthogonal DNA sequences to DNA nanotechnology."
2023,Identifying functional groups in microbial communities based on ecological patterns,https://hdl.handle.net/1721.1/152708,"Recent development in sequencing technologies has greatly advanced our understandings of structure and function of microbial communities in various ecosystems. In microbial communities, a metabolic function is often performed by a group of multiple species (i.e., a functional group) at the same time. However, identifying these functional groups remains to be a major challenge for structure-function mapping in microbiome studies. Instead of relying on annotation-based methods that are highly biased for a few model microorganisms, here I tackle this challenge by developing a novel annotation-free approach. In chapter two, I develop the mathematical framework behind the new approach – which we call EQO – and show its power by applying it to a few existing microbiome datasets. I show that, based solely on the patterns of statistical variation in species abundances, EQO identifies functional groups in soil, ocean and animal gut microbiome. The following two chapters discuss an application of this method, which has led to the discovery a potential new form of interaction between bacteria in animal guts, and an unexpected finding in the lab regarding the ecological dynamics of phage-plasmids in marine bacterial populations. In chapter three, I show how applying EQO to an aquaculture dataset leads us to identify potential pathogen-inhibiting groups of bacteria in an animal-associated microbiome. Guided by the computational prediction, I successfully isolate a member of this group that is a novel species with a broad spectrum of interaction against various Vibrio pathogens. By synthesizing and secreting polysaccharides, the novel species causes limited dispersion and reduced virulence of Vibrio. My efforts to understand the ecology of marine bacteria also lead me to study the role of widely distributed phage-plasmids. Combining mathematical models and experimental evidence, I show that loss-of-function mutations and segregational drift recurrently drive productive infections of phage-plasmids within marine bacterial populations. Together, this thesis provides a simple yet powerful approach to abstract functional groups from taxonomic composition in complex microbiome. As a useful hypothesis generating tool, this approach will pave the way for more mechanistic studies of microbiome in the future."
2023,On Semi-supervised Estimation of Distributions,https://hdl.handle.net/1721.1/151386,"We study the problem of estimating the joint probability mass function (pmf) over two random variables. In particular, the estimation is based on the observation of 𝑚 samples containing both variables and 𝑛 samples missing one fixed variable. We adopt the minimax framework with [notation] loss functions, and we show that the composition of uni-variate minimax estimators achieves minimax risk with the optimal first-order constant for 𝑝 ≥ 2, in the regime 𝑚 = 𝑜(𝑛)."
2023,Physics-Inspired Deep Learning for Inverse Problems in MRI,https://hdl.handle.net/1721.1/152787,"We demonstrate the power of combining the forward image acquisition model with deep learning solutions for inverse problems in magnetic resonance imaging (MRI), from individual network layers to the network architecture design and inference procedure.

First, we propose neural network layers that combine image space representations with representations in Fourier space, where MRI data is acquired. These layers can be used as drop-in replacements for standard image space convolutions in a variety of network architectures and yield higher quality reconstructions across a wide range of MR imaging tasks.

Next, we demonstrate a deep learning framework for rigid-body motion correction in MRI, where the forward imaging model informs both the network architecture and the inference procedure. Our method incorporates potentially unknown motion parameters as inputs to the network and then optimizes them for each test example. The optimization is performed via an objective function that forces the reconstructed image and estimated motion parameters to be consistent with the acquired data. This approach reduces the joint image-motion parameter search used by most motion correction strategies to an inference-time search over motion parameters alone, greatly simplifying the complexity of the optimization problem to be solved for a novel image. Our hybrid method achieves the high reconstruction quality metrics that characterize deep learning solutions while retaining the benefits of explicit model-based optimization – in particular, the ability to reject examples where the network produces poor reconstructions. Experiments demonstrate the advantages of this combined approach over purely learning or model-based reconstruction techniques."
2023,The Coordination Imperative: A Comprehensive Approach to Align Customer Demand and Inventory Management for Superior Customer Experience in Retail,https://hdl.handle.net/1721.1/152447,"The rapid growth of customers traversing different channels during their buying journey presents both opportunities and challenges for organizations. Fragmented decision-making and siloed communication between marketing and supply chain teams can lead to inefficiencies and negatively impact customer experience. This thesis proposes a conceptual framework to align customer demand and inventory management. The framework is examined in the empirical context of the fashion industry, focusing on the US market and insights from Brazil and Japan. By introducing a PDCA (Plan Do Check Action) process and cross-functional metrics, such as NPS (Net Promoter Score) and OTIF (On time in Full), this study seeks to encourage cooperation between departments and coalesce decision-making around enhancing customer experience. The research will explore the quantitative and qualitative aspects of the retail industry focusing on fashion and identify opportunities to leverage technology, marketing, and supply chain management for improved performance. Our study validated the existence of siloed operations and the drawbacks caused by silos in today’s business. Through 16 expert interviews, we identify three key factors that contribute to silos between marketing and supply chain. They are technology fragmentation, lack of integrated KPIs, and complexity of multiple channels. Further, the interviews helped uncover how the experts tackled these challenges in daily operations.

The expected deliverable is a framework that combines analyzed customer journeys with cross-functional metrics to support decision-makers in day-to-day operations. The goal is to deliver a world-class customer experience by aligning decisions to coordinate actions. There is potential to incorporate machine learning to suggest experiments and further optimize value delivery for 4  customers by retailers through multiple channels. Our conceptual framework applies to various businesses struggling with coordination between demand generation and fulfillment."
2023,Studying Electronic Textures with Coherent Lensless Imaging,https://hdl.handle.net/1721.1/152958,"X-ray microscopes have opened our collective eyes to the richness of nanoscale texture in systems such as correlated and quantum materials. These microscopes draw their power from the combination of short wavelengths, which provide high resolution, and interaction with atomic resonances, which makes them sensitive to subtle changes in electronic structure. However, x-ray microscopy remains an area where the main limits are technological rather than fundamental. Therefore, major progress is still possible with methodological improvements.

In the past twenty years, research has exploded into the use of coherent x-ray light to improve the quality and resolution of x-ray microscopes. In many cases, using coherent light makes it possible to remove the objective lens in a microscope, replacing it with an algorithmic analysis of the direct scattering data. This can increase the quality and resolution of the resulting quantitative images.

In this thesis, I present the results from a collection of projects aimed at using coherent imaging methods to study the real-space texture of electronic phases of matter with soft x-ray light. I first discuss the methods we developed and implemented to counteract the experimental errors that we found to be ubiquitous in our data, focusing on ptychography, the most commonly used lensless imaging method. Then, I turn to the development of an entirely new single-shot lensless imaging method, randomized probe imaging (RPI).

RPI has proven to be reliable and robust across a broad range of scenarios. The remainder of the thesis is devoted to applications of RPI at a free electron laser and a synchrotron. Also reported are further projects designed to improve the method, as well as attempts to expand our understanding of the mechanisms behind it and its limitations. I sincerely hope that the availability of RPI will help bring x-ray imaging to a broader group of scientists and lead to a better understanding of the nanoscale details of electronic texture."
2023,Systematic Modeling and Design of Sparse Deep Neural Network Accelerators,https://hdl.handle.net/1721.1/151571,"Sparse deep neural networks (DNNs) are an important computation kernel in many data and computation-intensive applications (e.g., image classification, speech recognition, and language processing). The sparsity in such kernels has motivated the development of many sparse DNN accelerators. However, despite the abundant existing proposals, there has not been a systematic way to understand, model, and develop various sparse DNN accelerators. 

To address these limitations, this thesis first presents a taxonomy of sparsity-related acceleration features to allow a systematic understanding of the sparse DNN accelerator design space. Based on the taxonomy, it proposes Sparseloop, the first analytical modeling tool for fast, accurate, and flexible evaluations of sparse DNN accelerators, enabling early-stage exploration of the large and diverse sparse DNN accelerator design space. Across representative accelerator designs and workloads, Sparseloop achieves over 2000× faster modeling speed than cycle-level simulations, maintains relative performance trends, and achieves ≤ 8% average modeling error. 

Employing Sparseloop, this thesis studies the design space and presents HighLight, an efficient and flexible sparse DNN accelerator. Specifically, HighLight accelerates DNNs with a novel sparsity pattern, called hierarchical structured sparsity, with the key insight that we can efficiently accelerate diverse degrees of sparsity (including dense) by having them hierarchically composed of simple sparsity patterns. Compared to existing works, HighLight achieves a geomean of upto 6.4× better energy-delay product (EDP) across workloads with diverse sparsity degrees, and always sits on the EDP-accuracy Pareto frontier for representative DNNs."
2023,SenseMate: An AI-Based Platform to Support Qualitative Coding,https://hdl.handle.net/1721.1/151980,"Unstructured data can be analyzed numerically or qualitatively through methods like sensemaking. One of the key stages of sensemaking is qualitative coding, where the data is divided into units, and each unit is assigned a category or code. Unfortunately, coding is tedious and time-consuming when carried out manually. Finding a balance between manual and fully-automated coding can help increase efficiency while allowing human judgment and preventing systematic machine errors. In this thesis, I propose an accessible semi-automated approach to qualitative coding. First, I apply a novel machine learning method, rationale extraction models, to qualitative coding. These models recommend themes for each unit of analysis in qualitative data and tend to perform better with less ambiguous themes. Through an online experiment, I find that assistance from rationale extraction models increases coding performance and reliability. Next, I execute an iterative, human-centered design process to create SenseMate, an AI-based platform for qualitative coding. After 13 user testing sessions and 3 design iterations, I observe that model overreliance can be minimized through cognitive forcing functions and easy-to-understand model explanations. I also design several ways for users to efficiently provide feedback on machine-generated rationales. To connect my model and design evaluations, I implement a prototype of SenseMate and conduct a summative user evaluation through an online experiment. The evaluation reveals that participants with access to AI assistance have higher coding performances but spend more time on the platform. The effectiveness of various design decisions within SenseMate is also explored. Finally, I discuss a myriad of future work possibilities. Overall, this thesis offers a practical and accessible solution to analyzing unstructured data, which has broad applications for researchers and organizations across various fields."
