Year,Title,Link,Abstract
2020,New optimization approaches to matrix factorization problems with connections to natural language processing,https://hdl.handle.net/1721.1/127291,"The new approach builds uncertainty sets using one-sided constraints and two hypothesis tests, uses alternating optimization and projected gradient methods, including Adam and mirror descent, to find good local optima. In computational experiments, we demonstrate that these models are better able to avoid over-fitting than LDA and PLSA, and result in more accurate reconstruction of the underlying topic matrices. In Chapter 5, we develop modifications to latent Dirichlet allocation to account for differences in the distribution of topics by authors. The chapter adds author-specific topic priors to the generative process and allows for co-authorship, providing the model with increased degrees of freedom and enabling it to model an enhanced set of problems. The code for the algorithms developed in each chapter in the Julia language is available freely on GitHub at https://github.com/lauren897"
2020,An adaptive partitioning scheme for ad-hoc and time-varying database analytics,http://hdl.handle.net/1721.1/105961,"Data partitioning significantly improves query performance in distributed database systems. A large number of techniques have been proposed to efficiently partition a dataset, often focusing on finding the best partitioning for a particular query workload. However, many modern analytic applications involve ad-hoc or exploratory analysis where users do not have a representative query workload. Furthermore, workloads change over time as businesses evolve or as analysts gain better understanding of their data. Static workload-based data partitioning techniques are therefore not suitable for such settings. In this thesis, we present Amoeba, an adaptive distributed storage system for data skipping. It does not require an upfront query workload and adapts the data partitioning according to the queries posed by users over time. We present the data structures, partitioning algorithms, and an efficient implementation on top of Apache Spark and HDFS. Our experimental results show that the Amoeba storage system provides improved query performance for ad-hoc workloads, adapts to changes in the query workloads, and converges to a steady state in case of recurring workloads. On a real world workload, Amoeba reduces the total workload runtime by 1.8x compared to Spark with data partitioned and 3.4x compared to unmodified Spark."
2020,Coflow scheduling in data center networks,https://hdl.handle.net/1721.1/124265,"In this work, I analyze the problem of coflow scheduling on a multi-stage cross bar switch with a set of intermediate ports. Using a multi-stage abstraction for the data center network enables development of algorithms that reduce the network latency for certain traffic patterns. In this context, I compare the capabilities of the multi-stage network with the cross-bar switch via simulations and theoretical calculations. A theoretical upper bound of 1/e was shown for the ratio of the difference between the minimum total coflow completion times (TCCT) on these two networks and the minimum TCCT on the cross-bar switch. On the other hand, simulations using approximation algorithms gave values of up to 8 percent for the average of the same ratio under randomly generated trac patterns."
2020,Adaptive sampling of transient environmental phenomena with autonomous mobile platforms,https://hdl.handle.net/1721.1/124212,"is subsequently presented, which addresses the MSS problem and overcomes key technical challenges with planning in natural environments. Theoretical performance guarantees are derived for PLUMES, and empirical performance is demonstrated against canonical uniform search and state-of-the-art baselines in simulation and field trials. Ultimately, this thesis examines the challenges of autonomous informative sampling in the environmental and earth sciences. In order to create useful systems that perform diverse scientific objectives in natural environments, approaches from robotics planning, field design, Bayesian optimization, machine learning, and the sciences must be drawn together. PLUMES captures the breadth and depth required to solve a specific objective within adaptive sampling, and this work as a whole highlights the potential for mobile technologies to perform intelligent autonomous science in the future."
2020,Deep learning with physical and power-spectral priors for robust image inversion,https://hdl.handle.net/1721.1/127013,"Conversely, if more restricted examples are used as training examples, the training can be guided to undesirably ""remember"" to produce the ones similar as those in training, making the cross-domain generalization problematic. Next, we also propose to use deep learning to greatly accelerate the optical diffraction tomography algorithm. Unlike previous algorithms that involve iterative optimization algorithms, we present significant progresses towards 3D refractive index (RI) maps from a single-shot angle-multiplexing interferogram. Last but not least, we propose to use cascaded neural networks to incorporate the system physics directly into the machine learning algorithms, while leaving the trainable architectures to learn to function as the ideal Proximal mapping associated with the efficient regularization of the data. We show that this unrolled scheme significantly outperforms the End-to-End scheme, in low-light imaging applications."
2020,Dynamic and robust network resource allocation,https://hdl.handle.net/1721.1/123565,"We formulate a dynamic robust optimization model that addresses this decision question, apply a tractable solution heuristic, and prove theoretical guarantees of the heuristic's performance. Our model is calibrated with publicly available data to generate insights on how the policymakers should balance investment between medical inventory and personnel training. The World Health Organization and regional public health authorities decide on the influenza (flu) vaccine type ahead of flu season every year. Vaccine effectiveness has been limited by the long lead time of vaccine production - during the production period, flu viruses may evolve and vaccines may become less effective. New vaccine technologies, with much shorter production lead times, have gone through clinical trials in recent years. We analyze the question of optimal vaccine selection under both fast and slow production technologies. We formulate the problem as a dynamic distributionally robust optimization model."
2020,A Comparison of artificial intelligence algorithms for dynamic power allocation in flexible high throughput satellites,https://hdl.handle.net/1721.1/127074,"Although multiple AI approaches have been proposed in the recent years, most of the analyses have been conducted under assumptions that do not entirely reflect the new operation scenarios' requirements, such as near-real time performance or high-dimensionality. Furthermore, little work has been done in thoroughly comparing the performance of different algorithms and characterizing them. This Thesis considers the Dynamic Power Allocation problem, a DRM subproblem, as a use case and compares nine different AI algorithms under the same near-real time operational assumptions, using the same satellite and link budget models, and four different demand datasets. The study focuses on Genetic Algorithms (GA), Simulated Annealing (SA), Particle Swarm Optimization (PSO), Deep Reinforcement Learning (DRL), and hybrid approaches, including a novel DRL-GA hybrid. The comparison considers the following characteristics: time convergence, continuous operability, scalability, and robustness."
2020,"Urban computing using call detail records : mobility pattern mining, next-location prediction and location recommendation",http://hdl.handle.net/1721.1/104156,"Urban computing fuses computer science with other fields, such as transportation, in the context of urban spaces by connecting ubiquitous sensing technologies, analytical models and visualizations to solve challenging problems in urban environment and operation systems. This paper focuses on Call Detail Records, one widely collected opportunistic sensing data source for billing purposes, to understand presence patterns, develop mobility prediction methods and reduce traffic congestions with location recommendations. Understanding human mobility and presence patterns at locations are the building blocks for behavior prediction, service design and system improvements. In the first part, this thesis focuses on 1) understanding presence patterns at user locations with a proposed metric Normalized Hourly Presence, 2) extracting common presence patterns across the population with Principal Component Analysis; 3) and infer home and workplaces using K-means Clustering and Fuzzy C-means Clustering. The proposed method was implemented on MIT Reality Mining data, by which we demonstrate that with inference rates of 56% and 82%, the method can improve 79% and 34% in accuracy respectively in home and workplace inference comparing to the baseline model. In addition, it was implemented on the CDR data collected in a crowded city in China to prove its scalability and applicability in real-world applications. With Fuzzy C-means Clustering, we could flexibly trade-off between inference rate and accuracy to understand the interplay between the two and apply it for various purposes. With an understanding of mobility patterns, the next crucial foundation in urban computing is mobility prediction, enabling transportation practitioners to take actions beforehand and commercial organizations to send location-based advertisements, etc. Specifically, this paper focuses on next-location prediction from Call Detail Records. Mobility traces was analogized to language models, mapping cell towers to words and individual location traces to sentences. Recurrent Neural Network is a successful tool in natural language processing, which is applied in mobility prediction due to its acceptance of sequential input, variable input length and ability to learn the 'meaning' of cell towers. By implementing the method on Call Detail Records collected in Andorra, we show that the method improved more than 40% over the baseline model, with 67% and 78% accuracy in next location at cell tower and merged cell tower level respectively. The 'meanings' of the cell tower could also be inferred, the same as learning the meanings of words in sentences, from the embedding layer of Recurrent Neural Network. The last project aims at tackling the challenge of severe traffic congestions with location recommendations. The availability of large-scale longitudinal geolocation data, such as Call Detail Records, offers planners and service providers an unprecedented opportunity to understand location preferences and alleviate traffic congestions. Location recommendation is a potential tool to achieve these two objectives. Previous research on location recommendations has focused on automatically and accurately inferring users' preferences, while little attention has been devoted to the constraints of service capacity. The ignorance may lead to congestion and long waiting time. We argue that Call Detail Records could help planners and authorities make interventions by providing personalized recommendations given the comprehensive urban-wide picture of historical behaviors and preferences. In this research, we propose a method to make location recommendations for system efficiency, defined as maximizing satisfactions toward recommendations subject to capacity constraints, exploiting travelers' choice flexibilities. We infer implicit location preferences based on sparse and passively-collected Call Detail Records. We then formulate an optimization model the defined system efficiency. As a proof-of-concept experiment, we implement the method in Andorra, a small European country heavily relying on tourism. By extensive simulations, we demonstrate that the method can reduce the travel time increased by congestion during peak hour from 11.73 minutes to 5.6 minutes with idealized trips under full compliance rates. We show that the average travel time increased by congestion is 6.17, 6.98, 8.37 and 10.98 minutes with 80%, 60%, 40% and 20% compliance rates. Overall, our results indicate that Call Detail Records can be used to make locations recommendation while reduce traffic congestion for system efficiency. The proposed method can be applied to other large-scale location traces and extended to other location or events recommendation applications."
2020,Design of an advanced sEMG processor for wearable robotics applications,https://hdl.handle.net/1721.1/124074,"This thesis presents the design and evaluation of a surface electromyography(sEMG) acquisition platform specialized for wearable robotic applications. While sEMG is one of the best ways to interpret human muscle and neural activity, the research field in wearable robotics has limitations in utilizing sEMG signals with commercially-available sEMG acquisition platforms. These limitations include a large and bulky electronics package, poor portability, insufficient electrode versatility, and limited reconfigurability. This thesis aims to present an effective design that provides solutions to these many difficulties while insuring robustness and acquisition signal quality. The thesis reasons and explains in detail every design decision and process among the system development and manufacturing. The evaluation of the manufactured system compared to a benchtop state-of-the-art sEMG recording platform is demonstrated. Practical utility of the developed sEMG measurement system is also demonstrated with a real world wearable robotic application."
2020,Mechanistic modeling of bacterial nutrient uptake strategies,https://hdl.handle.net/1721.1/124116,"Bacteria have developed a variety of strategies to nd and consume the substrates necessary for both the cell's energy-consuming processes and for the additional biomass needed to replicate. A greater understanding of the diversity and regulation of these strategies can provide us with a number of insights relevant for a variety of applications, from predicting bacterial population dynamics and thus carbon-cycling rates in the ocean to bio-engineering bacteria into microscale robots. Here I use toy, mechanistic models of single-cell metabolism that allow me to quantify the costs and benefits of various nutrient uptake strategies. I find that: (i) a sensing-uptake trade-off governs E. coli's regulation of maltose uptake and chemotaxis to maltose; (ii) a rate-affinity trade-off in nutrient transport systems governs the speciation of marine oligotrophic and copiotrophic heterotrophs; and (iii) an exploration-conservation trade-off governs the prevalence of motility in the marine microbial world. This work thus provides new understanding of how both phenotypic diversity and cellular regulation are governed by trade-offs for maximizing growth rate in dierent environments."
2020,Non-contact ultrasound,https://hdl.handle.net/1721.1/123779,"This thesis explores the design, development, and evaluation of two novel non-contact ultrasound imaging methods: immersion ultrasound and optical ultrasound. Immersion ultrasound utilizes traditional piezoelectric elements in a tomographic framework to develop new algorithms and acquisition methods for quantification of tissue geometry and properties in human proximal limbs. Bone is uniquely challenging for ultrasound due to the high impedance mismatch between bone and soft-tissue in the imaging domain. New imaging algorithms are necessary for both geometric and quantitative reconstruction of subjects with bone. Multiple immersion systems were designed and constructed using the framework presented in this thesis. Mechanical systems include a 4 degrees of freedom single element system and a fully flexible 36 degrees of freedom robotic system abbreviated MEDUSA (Mechanically Discrete Ultrasound Scanning Apparatus)."
2020,Long-wave infrared frequency combs based on quantum cascade lasers,http://hdl.handle.net/1721.1/113922,"Ever since the invention of quantum cascade laser (QCL), the performance and the flexibility in design has made it a desirable source for a wide range of applications, such as trace-chemical sensing, health monitoring, frequency metrology, noninvasive imgaing and infrared countermeasures. The LWIR region (or mid-infrared region), roughly ranging from 2-20 [mu]m, is of particular importance to spectroscopy applications, since many molecular species have their strongest rotational-vibrational absorption bands in that area. Infrared laser spectroscopy began about 40 years ago and has been using a variety of different tunable laser-based sources, particularly lead salt diodes, color center lasers, difference frequency generation and optical parametric oscillators. The large tunabilitiy in the design (lasing frequency, tunability, power, material system, etc.) and the compactness in fabrication and packaging has made QCL an ideal source for laser-based spectroscopy. Traditional spectroscopy systems suffer from problems like large physical dimensions, long data-processing times and spectral resolution restrictions. Therefore the development of a simple, robust, compact and inexpensive optical source/system like QCL frequency combs can largely benefit spectroscopy systems. In the past few years, QCLs have proven to be able to form comb radiation in both LWIR and THz regions. And dual comb spectroscopy has been demonstrated using QCL frequency combs with very short acquisition time ([mu]s). The development of a broadband, high power, narrow linewidth and stable LWIR frequency comb based on quantum cascade laser is the key to realizing such broadband ultrafast spectrometer in the mid-infrared range. This thesis explores the design, fabrication and characterization techniques towards the development of LWIR QCL frequency comb devices for spectroscopic purposes. A complete wet etch epi-up fabrication process is reported, with preliminary results on the dry-etch technique to incorporate dispersion compensation strucutre and epi-down fabricaiton for high power CW mode QCL device. Formation of comb(-like) regime has been observed in two devices, with the Gires-Tournois Interferometer (GTI) mirror providing dispersion from the rear facet. In order to improve the comb performance of these devices, dispersion of the device is measured to provide essential information for the design of chirped top cladding for dispersion compensation. This thesis provides an important step towards the realization of a room temperature, broadband, CW mode LWIR QCL frequency comb device for spectroscopic purposes."
2020,Preventing IPC-facilitated type confusion in Rust,https://hdl.handle.net/1721.1/128627,"Type-safe languages undertake to prevent the type confusion vulnerabilities that arise in type-unsafe languages such as C++. One such type-safe language is Rust, which provides powerful type safety guarantees [1]. However, these guarantees are valid only for a single compilation unit. That is, they may not hold when multiple separately compiled processes communicate. In this work, we explore how type confusion vulnerabilities can still arise when multiple separately compiled, internally type-safe processes share information through inter-process communication (IPC). We propose safeIPC, a tool for eliminating IPC-facilitated type confusion in Rust. safeIPC is a Rust compiler extension that detects communications over IPC and inserts runtime checks to ensure that type safety is maintained. Programs instrumented with safeIPC throw a runtime error if the type of any data received over IPC is not equivalent to the type expected. Our analysis shows that safeIPC is effective in preventing type confusion vulnerabilities not prevented by Rust alone."
2020,A stereo vision system with automatic brightness adaptation,http://hdl.handle.net/1721.1/9438,"This thesis describes the development of an automatic brightness adaptive imaging system for use in stereo vision algorithms implemented for a variety of processing architectures. A 256 x 256 array of wide dynamic range pixels with on-chip A/D converters provides the digital data path for a feedback network which controls the charge integration parameters at each pixel. The first goal of the project was to build a real-time demonstration of the imager with configurable compression functions. Secondly, electronic irising was employed by controlling the global charge integration time based on the average intensity of the image. In addition to electronic-irising, the imaging system employs a linear or a logarithmic compression scheme based on the image data. The controller fits the compression function to the image by comparing the average intensities of many different regions within the image. Finally, a 3-camera stereo-vision system was developed with data transfer to a PC through the PCI bus at 60fps. The imagers are synchronized and controlled based on the center imager's data which allows for consistent object correlation in stereo vision algorithms."
2020,Infrastructures for secure multiparty computation,https://hdl.handle.net/1721.1/127006,"We devise information theoretically secure protocols that allow additional pairs of parties to establish secure OT correlations using the help of other parties in the network in the presence of a dishonest majority. Our main technical contribution is an upper bound that matches known lower bounds regarding the number of OT channels necessary and sufficient for MPC. In particular, we characterize which n-party OT graphs G allow t-secure computation of OT correlations between all pairs of parties, showing that this is possible if and only if the complement of G does not contain the complete bipartite graph Kn-t,n-t as a subgraph. Finally, we study the problem of building an infrastructure for fair secure computation, where we guarantee that if any party receives the output of the secure computation, then all honest parties do as well."
2020,Modeling and tradespace exploration of a space suit hip bearing assembly using multi-degree-of-freedom range of motion analysis,https://hdl.handle.net/1721.1/124205,"Space suits are crucial to human spaceflight, but can restrict motion, require additional energy, and increase injury risk. Previous planetary suits were largely based on flexible components, which generate additional forces on the occupant as they resist volumetric changes from flexing components. The NASA Mark III suit addresses this problem using a Hip Brief Assembly (HBA), composed of rigid, constant-volume sections connected by bearings. However, due to the rigid components and fixed degrees of freedom (DoFs), the HBA and other hard-component joint assemblies (HCJAs) have stricter bounds on motion. For example, previous analysis shows that the hip multi-DoF range of motion (ROM) for an HBA occupant is not well-aligned with the nominal hip ROM during gait (gait NHROM). In this thesis, a set of methods for describing HCJA geometry and the effect on occupant ROM is presented."
2020,Tracking engagement : a machine learning framework for estimating affective engagement,https://hdl.handle.net/1721.1/127333,"Globally, construction fatality counts remain among the highest of all industries. As part of efforts to improve workers occupational health and safety, most companies provide workers with ongoing safety training. Yet accidents continue to take place, as there is a lack of understanding on how to increase the knowledge transfer that would help improve safety. The goal of this thesis is to automate and improve manual observation methods, presently used to determine construction workers' engagement during training courses by applying machine learning techniques to video images. This thesis proposes a framework to measure construction workers' engagement during training courses by unobtrusively analyzing engagement through body and pose estimation, codifying who is speaking and understating the predicted emotional state of a given worker through their facial expressions of emotion at specific lectures times through stateof- the-art computer vision techniques. The framework was prototyped on fifteen graduate and undergraduate students from a private university in the United States during four class sessions in a stadium set up classroom by three high definition cameras. The proposed system can enhance our understanding of learning processes within classroom contexts, while reducing the labor-intensive process of traditional observations methods, and allowing for the observation of a full class simultaneously. Further, the repeatability and standardization of objective observations will be improved as it will no longer depend on the skills of the observer and on his or her ability to capture and make sense of what was observed."
