Year,Title,Link,Abstract
2022,Predicting Audience Tweet Engagement,https://hdl.handle.net/1721.1/143330,"Social media has become the ubiquitous infrastructure through which the world is connected. It allows people to interact not only with family members and friends but also with prominent figures like movie stars, presidential candidates, and even royalty. These celebrities have immense presences on social media, and each post they share has the potential to reach millions of people. As the sphere of social media influence grows increasingly large, it also becomes increasingly important to be able to understand how influencers on social media affect their audience. However, it is difficult for individuals with large social media platforms to gain insight into how their posts influence their followers. While social media platforms do provide influencers with some audience breakdowns and statistics, they are often not granular enough to be useful. In this thesis, we present methods to analyze an influencer’s tweets and audience. We then use these results to predict which segments of an influencers audience will interact with different types of posts. These insights can help determine which areas an influencer has the greatest potential to make an impact in and thus guide the direction and content of influencer campaigns."
2022,Design and Analysis of a Novel Wave Energy Converter With a Tension Leg Platform and Oscillating Proof Masses,https://hdl.handle.net/1721.1/143342,"A design of novel wave energy converter with an oscillating proof mass and an electromagnetic power takeoff mechanism was considered. The wave energy converter has two parts, a tension leg platform connected by tether lines to the sea floor and inside of it, proof mass oscillators with motions which are coupled to those of the tension leg platform. In order to simplify the analysis, the system was constrained to only oscillate in the direction of surge. Complex hydrodynamic forces caused by ocean waves will excite the system and the surge motion of the proof mass relative to the tension leg platform will generate power via the electromagnetic power takeoff mechanism. First a model of the system with a linear restoring force exerted on the proof mass is analyzed using linear theory. Following the development of the linear theory, a more complex model with a nonlinear restoring force was considered. Using both a frequency-domain approach and a time-domain simulation, the average power of these systems were calculated. To further maximize power, a control circuit and control law are introduced which increase the average power by multiple factors. By introducing nonlinear restoring force and a control law, the performance of the system was shown to be further improved."
2022,Uncertainty-Based Design Optimization and Decision Options for Responsive Maneuvering of Reconfigurable Satellite Constellations,https://hdl.handle.net/1721.1/145138,"There are many time-sensitive mission applications for persistent satellite coverage, including dynamic and unpredictable events such as natural disasters, oil spills, extreme weather events, or geopolitical conflicts, which may progress rapidly and require frequently-updated information to co-ordinate the ground response. Reconfigurable satellite constellations can provide on-demand regional coverage by maneuvering orbits to focus passes over the area of interest. In contrast, traditional satellite constellations cannot maneuver to pass over specific ground locations, meaning that achieving persistent coverage spanning all possible locations of interest globally results in a requirement for thousands of satellites. This would present prohibitive costs for many applications, as well as contributing to worsening issues of space traffic management and congestion in Low Earth Orbit (LEO).

Incorporating reconfigurability into constellation design allows for responsive maneuvering of satellites into repeating ground tracks (RGTs) over a location of interest, simultaneously reducing the required constellation size by improving the utilization of individual satellites and providing flexibility in the achievable ground coverage. Past work on reconfigurable constellations (ReCon) demonstrated average cost savings of 20-70% compared to iso-performance static constellations, although the complexity of the solution space for the design optimization process limited the maximum size of constellations that could be evaluated.

In this thesis, a probabilistic performance metric is developed to compare constellation designs, adopting principles of reliability-based design optimization to quantify the confidence level that reconfigurable designs will outperform iso-cost static alternatives and by what margin of performance. The results show that 74.2% of reconfigurable designs outperform iso-cost static designs with a confidence level of 90% or higher, and with a margin of at least 10% improvement in the level of performance achieved. Computational intensity of the model presents the major constraint upon the size and complexity of simulation cases that may be modelled, so variance reduction techniques are applied to lower the standard error of mean performance in the output, allowing for a reduction in optimization size and runtime while maintaining the same level of error in the predicted results. Decision options for the operational phase of a reconfigurable constellation are presented and assessed to characterize how satellite operators must weigh mission priorities to evaluate trade-offs between propellant conservation and improved coverage of high-value targets."
2022,Reducing intraday patient wait times through just-in-time bed assignment,http://hdl.handle.net/1721.1/99014,"Massachusetts General Hospital (MGH) is the oldest and largest hospital in New England as well as the original and largest teaching hospital of the Harvard Medical School. The neuroscience units experience patient flow issues similar to those observed throughout MGH, including high bed utilization and long intraday patient wait times. This project focuses on the neuroscience units as a microcosm of the hospital. MGH consistently operates near capacity. Patients from the emergency department, the perioperative environment, intensive care units (ICUs) and other sources compete for beds. The admitting department manages the bed assignment process across MGH. Assignments are often made without access to all relevant information, such as expected admission, surgery and discharge timing. As a result of common procedures, patients are frequently assigned to a bed before they are clinically ready to move. Our analysis reveals that suboptimal bed assignment and patient transfer processes are among the leading root causes of intraday patient delays. The primary objective of the project is to develop a bed assignment policy to reduce intraday patient wait times. The policy consists of a bed assignment algorithm and enabling bed management processes. To account for patient acuity, the algorithm segments patients by movement (e.g., ED-to-ICU). The target maximum wait for each segment is the acceptable wait length (AWL). The algorithm ranks patients based on their ready times and the AWLs, and assigns beds primarily on a just-in-time (JIT) basis. The enabling bed management processes include small-scale early discharge and early transfer interventions to better align the intraday timing of demand for inpatient beds with available capacity. A simulation of neuroscience patient flow is used to evaluate different approaches. The model shows that adoption of the JIT policy would increase the percentage of patients who experience bed waits within the AWL for all movement types. Predicted bed waits for patients who require ICU-level care would be 30 minutes or less for 90% of ED patients and 95% of OR patients (improvements from historical baselines of 44% and 91%, respectively). Predicted bed waits for transfers to floor beds would be two hours or less for 81% of ED patients and 93% of OR patients (improvements from historical baselines of 63% and 84%, respectively). The solution significantly reduces intraday patient wait times without a major increase in hospital capacity."
2022,Double-gated field emission arrays,http://hdl.handle.net/1721.1/30099,"There is a need for massively parallel, individually addressed and focused electron sources for applications such as flat panel displays, mass storage and multi-beam electron beam lithography. This project fabricates and characterizes double-gated field emission devices with high aspect ratio. One of the gates extracts the electrons while the second gate focuses the electrons into small spots. High aspect ratio silicon field emitters were defined by reactive ion etching of silicon followed by multiple depositions of polycrystalline oxide insulators and silicon gates. The layers were defined by a combination of lithography, chemical mechanical polishing and micromachining. We obtained devices with gate and focus apertures of 0.4[mu]m and 1.2[mu]m diameter. The anode current has very little dependence on the focus voltage and the ratio of the focus field factor to the gate field factor βF / βG is 0.015. Scanning electron micrographs of the devices, numerical simulation and spot size measurements on a phosphor screen confirmed these results. An e-beam resist, PMMA, was successfully exposed using the FEA device as an electron source."
2022,Optimal sizing of solar and battery assets in decentralized micro-grids with demand-side management,http://hdl.handle.net/1721.1/108959,"Solar-based community micro-grids and individual home systems have been recognized as key enablers of electricity provision to the over one billion people living without energy access to-date. Despite significant cost reductions in solar panels, these options can still be cost-prohibitive mainly due over-sizing of generation assets corresponding with a lack of ability to actively manage electricity demand. The main contribution shared is the methodology and optimization approach of least-cost combinations of generation asset sizes, in solar panels and batteries, subject to meeting reliability constraints; these results are based on a techno-economic modeling approach constructed for assessing decentralized micro-grids with demand-side management capabilities. The software model constructed is implemented to represent the technical characteristics of a low-voltage, direct current network architecture and computational capabilities of a power management device. The main use-case of the model presented is based on serving representative, aggregated, household-level load profiles combined with simulated power output from solar photovoltaic modules and the kinetic operating constraints of lead-acid batteries at hourly timesteps over year-long simulations. The state-space for solutions is based on available solar module and battery capacities from distributors in Jharkhand, India. Additional work presented also extends to real-time operation of such isolated micro-grids with requisite local computation. First, for load disaggregation and forecasting purposes, clustering algorithms and statistical learning techniques are applied on quantitative results from inferred load profiles based on data logged from off-grid solar home systems. Second, results from an optimization approach to accurately parametrize a lead-acid battery model for potential usage in real-time field implementation are also shared. Economic results, sensitivity analyses around key technical and financial input assumptions, and comparisons in cost reductions due to the optimization of solar and battery assets for decentralized micro-grids with demand-side management capabilities are subsequently presented. The work concludes with insights and policy implications on establishing differentiated willingness-to-pay, tiers of service, and dynamic price-setting in advanced micro-grids."
2022,Design and analysis of a 6/4-GHz receiver front end,http://hdl.handle.net/1721.1/37783,"Thesis (M. Eng.)--Massachusetts Institute of Technology, Dept. of Electrical Engineering and Computer Science, 1995."
2022,Representing troubleshooting information for a high-volume production line,http://hdl.handle.net/1721.1/35384,"Thesis (M.S.)--Massachusetts Institute of Technology, Sloan School of Management, 1994, and Thesis (M.S.)--Massachusetts Institute of Technology, Dept. of Electrical Engineering and Computer Science, 1994."
2022,Algorithms for simulating human pre-mRNA splicing decisions,http://hdl.handle.net/1721.1/37066,"In this thesis, I developed a program, ExonScan, to simulate constitutive human pre-mRNA splicing. ExonScan includes several models for splicing components, including splice sites, exonic splicing enhancers, exonic splicing silencers, and intronic splicing enhancers. I used ExonScan to test various aspects of human splicing, including correlation of splicing signal strength with tissue expression levels, the effectiveness of experimentally determined exonic splicing silencers, and splice site identification."
2022,Modeling of micro-electro-mechanical integrated test structures,http://hdl.handle.net/1721.1/36044,"Thesis (M. Eng.)--Massachusetts Institute of Technology, Dept. of Electrical Engineering and Computer Science, 1995."
2022,Multiple machine maintenance : applying a separable value function approximation to a variation of the multiarmed bandit,http://hdl.handle.net/1721.1/87269,"Thesis (M.Eng.)--Massachusetts Institute of Technology, Dept. of Electrical Engineering and Computer Science, 2002."
2022,Improving equipment performance through queueing model applications,http://hdl.handle.net/1721.1/38050,"Thesis (M.S.)--Massachusetts Institute of Technology, Sloan School of Management, 1995, and Thesis (M.S.)--Massachusetts Institute of Technology, Dept. of Electrical Engineering and Computer Science, 1995."
2022,A stacked full-bridge microinverter topology for photovoltaic applications,http://hdl.handle.net/1721.1/85805,"Previous work has been done to develop a microinverter for solar photovoltaic applications consisting of a high-frequency series resonant inverter and transformer section connected to a a cycloconverter that modulates the resonant current into a single-phase 240 VRMS utility line. This thesis presents a new stacked full-bridge topology that improves upon the previous high-frequency inverter section. By utilizing new operating modes to reduce the reliance on frequency control and allowing for the use of lower blocking voltage transistors, the operating frequency range of the HF inverter is reduced and efficiency is increased, especially at low output powers and lower portions of the line cycle. The design of an experimental prototype to test the stacked full-bridge HF inverter topology is presented along with test results that demonstrate the success of the topology. Future improvements to increase performance are also suggested."
2022,Modeling the appearance of cloth,http://hdl.handle.net/1721.1/14924,"Thesis (M.S.)--Massachusetts Institute of Technology, Dept. of Electrical Engineering and Computer Science, 1987."
2022,Real property portfolio management : a decision-support model,http://hdl.handle.net/1721.1/70166,"In the 1980's corporate real estate has assumed a more active role in the strategic planning of American corporations. However, the tools to accurately evaluate the performance of corporate real property portfolios are still at a very rudimentary stage in their development. This thesis concentrates on the space inventory system of a large corporation and presents a model for determining fair comparisons between buildings across the portfolio. A technique is devised for identifying ""outliers"", that is, buildings whose performance is significantly different from other buildings of the same type. This technique shows how to classify buildings into groups, so that building class standards can be determined and trends identified. Artificial Intelligence tools such as decision-support systems can be helpful to encode the expertise for evaluating buildings' performance levels. Through the design of two working demos the thesis illustrates how that is possible, and points towards future alternatives. The author spent an academic semester as a consultant/ intern in the real estate division of a multinational corporation. For anonymity purposes, the corporation is called the Star Corporation. The Star Corp. provided the data used in the research, as well as the supervision and training in their in-house systems operation."
2022,Frequency domain model-based intracranial pressure estimation,http://hdl.handle.net/1721.1/77016,"Elevation of intracranial pressure (ICP), the pressure of the fluid surrounding the brain, can require urgent medical attention. Current methods for determining ICP are invasive, require neurosurgical expertise, and can lead to infection. ICP measurement is therefore limited to the sickest patients, though many others could potentially benefit from availability of this vital sign. We present a frequency-domain approach to ICP estimation using a simple lumped, linear time-invariant model of cerebrovascular dynamics. Preliminary results from 28 records of patients with severe traumatic brain injury are presented and discussed. Suggestions for future work to improve the estimation algorithm are proposed."
2022,A multiscale framework for Bayesian inference in elliptic problems,http://hdl.handle.net/1721.1/65322,"The Bayesian approach to inference problems provides a systematic way of updating prior knowledge with data. A likelihood function involving a forward model of the problem is used to incorporate data into a posterior distribution. The standard method of sampling this distribution is Markov chain Monte Carlo which can become inefficient in high dimensions, wasting many evaluations of the likelihood function. In many applications the likelihood function involves the solution of a partial differential equation so the large number of evaluations required by Markov chain Monte Carlo can quickly become computationally intractable. This work aims to reduce the computational cost of sampling the posterior by introducing a multiscale framework for inference problems involving elliptic forward problems. Through the construction of a low dimensional prior on a coarse scale and the use of iterative conditioning technique the scales are decouples and efficient inference can proceed. This work considers nonlinear mappings from a fine scale to a coarse scale based on the Multiscale Finite Element Method. Permeability characterization is the primary focus but a discussion of other applications is also provided. After some theoretical justification, several test problems are shown that demonstrate the efficiency of the multiscale framework."
2022,Asynchronous distributed flow control algorithms,http://hdl.handle.net/1721.1/15388,"Thesis (Ph.D.)--Massachusetts Institute of Technology, Dept. of Electrical Engineering and Computer Science, 1984."
2022,Studies in discrete dynamic programming,http://hdl.handle.net/1721.1/31055,"Thesis (Sc. D.)--Massachusetts Institute of Technology, Dept. of Electrical Engineering, 1958."
2022,A strategic perspective on the commercialization of artificial intelligence : a socio-technical analysis,https://hdl.handle.net/1721.1/122431,"Many companies are increasing their focus on Artificial Intelligence as they incorporate Machine Learning and Cognitive technologies into their current offerings. Industries ranging from healthcare, pharmaceuticals, finance, automotive, retail, manufacturing and so many others are all trying to deploy and scale enterprise Al systems while reducing their risk. Companies regularly struggle with finding appropriate and applicable use cases around Artificial Intelligence and Machine Learning projects. The field of Artificial Intelligence has a rich set of literature for modeling of technical systems that implement Machine Learning and Deep Learning methods. This thesis attempts to connect the literature for business and technology and for evolution and adoption of technology to the emergent properties of Artificial Intelligence systems. The aim of this research is to identify high and low value market segments and use cases within the industries, prognosticate the evolution of different Al technologies and begin to outline the implications of commercialization of such technologies for various stakeholders. This thesis also provides a framework to better prepare business owners to commercialize Artificial Intelligence technologies to satisfy their strategic goals."
2022,Global and Robust Optimization for Engineering Design,https://hdl.handle.net/1721.1/143181,"There is a need to adapt and improve conceptual design methods through better optimization, in order to address the challenge of designing future engineered systems. Aerospace design problems are tightly-coupled optimization problems, and require all-at-once solution methods for design consensus and global optimality. Although the literature on design optimization has been growing, it has generally focused on the use of gradient-based and heuristic methods, which are limited to local and low-dimensional optimization respectively. There are significant benefits to leveraging structured mathematical optimization instead. Mathematical optimization provides guarantees of solution quality, and is fast, scalable, and compatible with using physics-based models in design. More importantly perhaps, there has been a wave of research in optimization and machine learning that provides new opportunities to improve the engineering design process. This thesis capitalizes on two such opportunities.

The first opportunity is to enable efficient all-at-once optimization over constraints and objectives that use arbitrary mathematical primitives. This work proposes a constraint sampling and learning approach for global optimization, leveraging developments in machine learning and mixed-integer optimization. More specifically, the feasible space of intractable constraints is sampled using existing and novel design of experiments methods, and learned using optimal classification trees with hyperplanes (OCT-Hs). OCT-Hs describe union-of-polyhedra approximations of intractable constraints, which are solved efficiently using commercial solvers to find near-feasible and near-optimal solutions to the global optimization problem. The constraints are then checked and the solution is repaired using projected gradient methods, ensuring feasibility and local optimality. The method is first tested on synthetic examples, where it finds the global optima for 9 out of 11 benchmarks, and high-performing solutions otherwise. Then it is applied to two real-world problems from the aerospace literature, and especially to a satellite on-orbit servicing problem that cannot be addressed via other global optimization methods. These applications demonstrate that decision tree driven optimization provides efficient, practical and optimal solutions to difficult global optimization problems present in aerospace design as well as other domains, regardless of the form of the underlying constraints.

The second opportunity is to optimize designs affected by parametric uncertainty in a tractable and deterministic manner, while providing guarantees of constraint satisfaction. Inspired by the wealth of literature on robust optimization, and specifically on robust geometric programming, this thesis proposes and implements robust signomial programming to solve engineering design problems under uncertainty. The methods are tested on a conceptual aircraft design problem, demonstrating that robust signomial programs are sufficiently general to address engineering design problems, solved efficiently by commercial solvers, and result in designs that protect deterministically against uncertain parameter outcomes from predefined sets. In addition, robust designs are found to be less conservative than designs with margins; robust aircraft demonstrate 9% better average performance than aircraft designed with margins over the same scenarios, while providing guarantees of constraint feasibility.

In anticipation of future aerospace design problems becoming increasingly coupled, complex and risky, this thesis provides a new perspective for dealing with design challenges using structured mathematical optimization. The proposed methods inject mathematical rigor into engineering design methods while keeping practical concerns for conceptual design in focus."
2022,"Dynamic responsiveness in the American states : legislators, constituents, and organized interests",https://hdl.handle.net/1721.1/121603,"In my second paper, I demonstrate the effectiveness of supervised machine learning methods in recognizing textual references to firms, organized interests, or any other political actors (an application of named entity recognition), and then resolving these references to real-world referents (an entity resolution task). Together, these methods make possible the large-scale measurement of political actors or their activity from sources such as diplomatic cables, transcripts, and administrative or legislative records. Organized interests are embedded in the legislative process in state capitols, writing bills and participating in committee meetings; they contribute stakeholder perspective and testify to the technical points of proposed legislation. Studying exactly which groups participate addresses a minimal standard for democratic governance. The third paper accomplishes this using the measurement strategy described in the second paper."
